{
  "ticket_id": "TCK-0001",
  "subject": "Critical: VPN Authentication Failure - AUTH_TIMEOUT preventing remote access",
  "body": "User cannot establish VPN connection from remote location since 08:30 AM EST. Consistent AUTH_TIMEOUT errors occurring during authentication phase. User has attempted: restarting VPN client (Cisco AnyConnect 4.10), rebooting workstation, and switching networks. Last successful connection was yesterday at 17:45. This is blocking access to critical financial systems for quarterly reporting.",
  "customer_id": "CUST-104",
  "customer_tier": "enterprise",
  "priority": "high",
  "sla_level": "platinum",
  "routing_tags": ["vpn", "authentication", "remote_access", "urgent"],
  "attachments": ["vpn_logs_20251120.zip"],
  "structured_context": {
    "affected_components": ["vpn_gateway", "auth_server"],
    "business_impact": "high",
    "user_count_affected": 1,
    "reproducibility": "consistent"
  },
  "metadata": {
    "ingest_timestamp": "2025-11-20T10:00:00Z",
    "channel": "email",
    "source_system": "zendesk",
    "language": "en",
    "word_count": 124,
    "urgency_indicator": "high",
    "first_contact": true,
    "escalation_path": "tier2_networking"
  }
}